{
    "$$type": "app/tool/docker-wrapper",
    "docker_image_ref": {
        "image_id": "b4df48a96d44",
        "image_repo": "images.sbgenomics.com/sevenbridges/sbg_bwa",
        "image_tag": "a019a90500aa39fd"
    }, 
    "schema": {
        "$$type": "schema/app",
        "inputs": {
            "type": "object",
            "required": ["inp"],
            "properties": {
                "inp": {"type": "string"}
            }
        },
        "params": {
            "type": "object",
            "required": ["expr"],
            "properties": {
                "expr": {"type": "string"},
                "context": {"type": "integer"}
            }
        },
        "outputs": {
            "type": "object",
            "properties": {
                "out": {"type": "string"}
            }
        }
    },
    "wrapper": {
        "base_cmd": ["grep"],
        "redirect": ["1>out.txt"],
        "mappings": {
            "expr": 0,
            "inp": 1,
            "context": "-C"
        },
        "outputs": {
            "out": "out.txt"
        }
    }
}
